{
  "$schema": "./extension-recipes-schema.json",
  "generatedAt": "2026-10-22T15:36:53.267Z",
  "version": "1.0.0",
  "categories": {
    "ci": {
      "name": "CI Integration",
      "description": "CI build verification and merge gates",
      "recipes": [
        {
          "name": "ci-gate-before-merge",
          "description": "Block merge/tag until CI passes",
          "extensionPoints": [
            "post-pr-create",
            "pre-tag",
            "post-prepare"
          ],
          "template": "### Wait for CI\n\n```bash\nnode .claude/scripts/shared/wait-for-ci.js --branch $(git branch --show-current) --timeout 900\n```\n\n**If CI fails, STOP and report the error.**\n\nCommon failures:\n- Build errors: Check compilation output\n- Test failures: Run tests locally to debug\n- Lint errors: Run linter with --fix",
          "prerequisites": [
            "wait-for-ci.js (included with framework)",
            "\"GitHub Actions workflows configured (run /ci to check status)\""
          ],
          "appliesTo": [
            "prepare-release:post-pr-create",
            "prepare-release:pre-tag",
            "prepare-beta:post-prepare",
            "prepare-beta:pre-tag",
            "merge-branch:post-pr-create"
          ]
        },
        {
          "name": "ci-status-check",
          "description": "Quick CI status without blocking workflow",
          "extensionPoints": [
            "post-analysis",
            "post-prepare"
          ],
          "template": "### Check CI Status\n\n```bash\ngh run list --limit 1 --json status,conclusion,name\n```\n\nReport status but do not block workflow.",
          "prerequisites": [
            "gh CLI (GitHub CLI)",
            "\"GitHub Actions workflows configured (run /ci to check status)\""
          ],
          "appliesTo": [
            "prepare-release:post-analysis",
            "prepare-beta:post-analysis",
            "prepare-release:post-prepare",
            "prepare-beta:post-prepare"
          ]
        },
        {
          "name": "cross-os-testing",
          "description": "Run CI tests across Ubuntu, Windows, and macOS using a matrix strategy",
          "extensionPoints": [
            "pre-validation",
            "pre-gate"
          ],
          "template": "### Verify Cross-OS CI\n\n```bash\ngh run list --limit 1 --json jobs --jq '.[0].jobs[] | select(.name | test(\"ubuntu|windows|macos\"; \"i\")) | {name, status, conclusion}'\n```\n\nConfirm all OS matrix jobs passed:\n- **Ubuntu:** ✅\n- **Windows:** ✅\n- **macOS:** ✅\n\n**If any OS job failed or is missing, STOP and investigate before continuing.**\n\nCommon cross-OS failures:\n- Path separators: Use `path.join()` instead of string concatenation\n- Case sensitivity: macOS/Windows are case-insensitive, Linux is not\n- Symlinks: Windows requires elevated permissions for symlinks\n- Line endings: Git autocrlf can cause test mismatches on Windows",
          "prerequisites": [
            "\"Cross-OS testing enabled in CI: /ci --add cross-os-testing\""
          ],
          "appliesTo": [
            "prepare-release:pre-validation",
            "prepare-beta:pre-validation",
            "merge-branch:pre-gate"
          ]
        }
      ]
    },
    "coverage": {
      "name": "Coverage",
      "description": "Code coverage gates and reporting",
      "recipes": [
        {
          "name": "coverage-gate",
          "description": "Block release if coverage drops below threshold",
          "extensionPoints": [
            "pre-validation",
            "post-validation"
          ],
          "template": "### Coverage Gate\n\nEnforce minimum coverage threshold before release:\n\n```bash\n# Example: Jest coverage with threshold\nnpx jest --coverage --coverageThreshold='{\"global\":{\"branches\":80,\"functions\":80,\"lines\":80,\"statements\":80}}'\n\n# Example: nyc check-coverage\nnyc check-coverage --lines 80 --functions 80 --branches 80\n```\n\n**If coverage drops below threshold, STOP the release.**",
          "prerequisites": [
            "Coverage tool configured (nyc, c8, jest --coverage, etc.)",
            "Coverage threshold defined in package.json or config"
          ],
          "appliesTo": [
            "prepare-release:pre-validation",
            "prepare-release:post-validation",
            "prepare-beta:pre-validation"
          ],
          "technology": [
            "node"
          ]
        },
        {
          "name": "coverage-report",
          "description": "Generate coverage report without blocking",
          "extensionPoints": [
            "post-validation",
            "post-prepare"
          ],
          "template": "### Coverage Report\n\nGenerate coverage report for review:\n\n```bash\n# Example: Generate HTML report\nnyc report --reporter=html --report-dir=coverage\n\n# Example: Upload to Codecov\nbash <(curl -s https://codecov.io/bash)\n```\n\nReport location: `coverage/index.html`",
          "prerequisites": [
            "Coverage tool configured",
            "(Optional) Codecov or similar service",
            "\"CI integration: /ci --add coverage-upload\""
          ],
          "appliesTo": [
            "prepare-release:post-validation",
            "prepare-beta:post-validation",
            "prepare-release:post-prepare",
            "prepare-beta:post-prepare"
          ],
          "technology": [
            "node"
          ]
        }
      ]
    },
    "deployment": {
      "name": "Deployment",
      "description": "Hosting platform deployment automation for preview, staging, and production environments",
      "recipes": [
        {
          "name": "deploy-health-check",
          "description": "Verify deployment health after staging or production deploys",
          "extensionPoints": [
            "post-merge",
            "post-tag"
          ],
          "template": "### Post-Deploy Health Check\n\nAfter a deployment completes, verify the application is healthy and responding correctly.\n\n```yaml\n# Add to existing deploy workflow as a post-deploy step\n- name: Health Check\n  run: |\n    DEPLOY_URL=\"${{ steps.deploy.outputs.url }}\"\n    MAX_RETRIES=5\n    RETRY_DELAY=10\n\n    for i in $(seq 1 $MAX_RETRIES); do\n      STATUS=$(curl -s -o /dev/null -w \"%{http_code}\" \"$DEPLOY_URL/api/health\")\n      if [ \"$STATUS\" = \"200\" ]; then\n        echo \"Health check passed (attempt $i)\"\n        exit 0\n      fi\n      echo \"Health check failed (attempt $i, status: $STATUS), retrying in ${RETRY_DELAY}s...\"\n      sleep $RETRY_DELAY\n    done\n    echo \"Health check failed after $MAX_RETRIES attempts\"\n    exit 1\n```\n\n**Health check targets:**\n- HTTP status code (200 OK)\n- Response time under threshold (e.g., < 2s)\n- Database connectivity verified\n- External service dependencies reachable",
          "prerequisites": [
            "Health check endpoint configured (e.g., /api/health or /healthz)",
            "Deployment URL available as environment variable or output"
          ],
          "appliesTo": [
            "merge-branch:post-merge",
            "prepare-release:post-tag",
            "prepare-beta:post-tag"
          ]
        },
        {
          "name": "digitalocean-preview-deploy",
          "description": "Deploy preview environments on DigitalOcean App Platform for each pull request",
          "extensionPoints": [
            "post-pr-create"
          ],
          "template": "### DigitalOcean Preview Deploy\n\nAfter PR creation, trigger a DigitalOcean App Platform deployment using the dev database or staging spec.\n\n```yaml\n# .github/workflows/do-preview.yml\nname: DigitalOcean Preview Deploy\non:\n  pull_request:\n    types: [opened, synchronize]\n\njobs:\n  deploy:\n    runs-on: ubuntu-latest\n    steps:\n      - uses: actions/checkout@v4\n      - name: Install doctl\n        uses: digitalocean/action-doctl@v2\n        with:\n          token: ${{ secrets.DIGITALOCEAN_ACCESS_TOKEN }}\n      - name: Deploy to App Platform\n        run: doctl apps create-deployment ${{ secrets.DO_APP_ID }}\n```\n\n**After deployment:**\n- App Platform provides a deployment URL in the doctl output\n- Comment the deployment URL on the PR",
          "prerequisites": [
            "DigitalOcean account with App Platform app configured",
            "DIGITALOCEAN_ACCESS_TOKEN in repository secrets",
            ".do/app.yaml or app spec configured"
          ],
          "appliesTo": [
            "merge-branch:post-pr-create",
            "prepare-release:post-pr-create"
          ]
        },
        {
          "name": "production-deploy-on-tag",
          "description": "Deploy to production when a release tag is pushed",
          "extensionPoints": [
            "post-tag"
          ],
          "template": "### Production Deploy on Tag\n\nAfter a release tag is pushed, deploy the tagged version to the production environment.\n\n```yaml\n# .github/workflows/production-deploy.yml\nname: Deploy to Production\non:\n  push:\n    tags: ['v*']\n\njobs:\n  deploy-production:\n    runs-on: ubuntu-latest\n    environment: production\n    steps:\n      - uses: actions/checkout@v4\n      - name: Extract Version\n        id: version\n        run: echo \"version=${GITHUB_REF#refs/tags/}\" >> $GITHUB_OUTPUT\n      - name: Deploy to Production\n        run: |\n          # Platform-specific production deploy\n          echo \"Deploying ${{ steps.version.outputs.version }} to production\"\n```\n\n**Production safeguards:**\n- Use GitHub environment protection rules (approvals, wait timers)\n- Deploy with the exact commit referenced by the tag\n- Monitor error rates and rollback if thresholds exceeded",
          "prerequisites": [
            "Production environment configured on hosting platform",
            "Deployment credentials in repository secrets",
            "Tag naming convention (v* pattern)"
          ],
          "appliesTo": [
            "prepare-release:post-tag",